<?xml version="1.0" encoding="UTF-8"?>
<!DOCTYPE audio_dataset SYSTEM "audio_dataset.dtd">

<audio_dataset>
	<contentVersion>1.0</contentVersion>
	<tables>
		<table>
			<ids>
				<id>
					<idname>10</idname>
					<cells>
						<cell>
							<entries>
								<entry>
									<entrytype>3</entrytype>
									<entryhandle>L_NA_1_1</entryhandle>
								</entry>
								<entry>
									<entrytype>0</entrytype>
									<entryhandle>LPSR_BROM_BoingHi_6</entryhandle>
								</entry>
							</entries>
						</cell>
					</cells>
				</id>
				<id>
					<idname>20</idname>
					<cells>
						<cell>
							<entries>
								<entry>
									<entrytype>3</entrytype>
									<entryhandle>L_NA_2_1</entryhandle>
								</entry>
								<entry>
									<entrytype>0</entrytype>
									<entryhandle>LPSR_BROM_BoingHi_6</entryhandle>
								</entry>
							</entries>
						</cell>
					</cells>
				</id>
				<id>
					<idname>30</idname>
					<cells>
						<cell>
							<entries>
								<entry>
									<entrytype>3</entrytype>
									<entryhandle>L_NA_1_1</entryhandle>
								</entry>
								<entry>
									<entrytype>0</entrytype>
									<entryhandle>LPSR_BROM_BoingHi_6</entryhandle>
								</entry>
								<entry>
									<entrytype>0</entrytype>
									<entryhandle>LPSR_BROM_BoingHi_6</entryhandle>
								</entry>
								<entry>
									<entrytype>0</entrytype>
									<entryhandle>LPSR_BROM_BoingHi_6</entryhandle>
								</entry>
								<entry>
									<entrytype>0</entrytype>
									<entryhandle>LPSR_BROM_BoingHi_6</entryhandle>
								</entry>
							</entries>
						</cell>
					</cells>
				</id>
				<id>
					<idname>40</idname>
					<cells>
						<cell>
							<entries>
								<entry>
									<entrytype>3</entrytype>
									<entryhandle>L_NA_2_1</entryhandle>
								</entry>
							</entries>
						</cell>
					</cells>
				</id>
			</ids>
        </table>
		<table>
			<ids>
				<id>
					<idname>20</idname>
					<cells>
						<cell>
							<entries>
								<entry>
									<entrytype>3</entrytype>
									<entryhandle>L_NA_3_1</entryhandle>
								</entry>
								<entry>
									<entrytype>0</entrytype>
									<entryhandle>LPSR_BROM_BoingHi_6</entryhandle>
								</entry>
							</entries>
						</cell>
					</cells>
				</id>
				<id>
					<idname>30</idname>
					<cells>
						<cell>
							<entries>
								<entry>
									<entrytype>3</entrytype>
									<entryhandle>L_NA_4_1</entryhandle>
								</entry>
								<entry>
									<entrytype>0</entrytype>
									<entryhandle>LPSR_BROM_BoingHi_6</entryhandle>
								</entry>
							</entries>
						</cell>
					</cells>
				</id>
				<id>
					<idname>40</idname>
					<cells>
						<cell>
							<entries>
								<entry>
									<entrytype>3</entrytype>
									<entryhandle>L_NA_5_1</entryhandle>
								</entry>
								<entry>
									<entrytype>0</entrytype>
									<entryhandle>LPSR_BROM_BoingHi_6</entryhandle>
								</entry>
							</entries>
						</cell>
					</cells>
				</id>
				<id>
					<idname>50</idname>
					<cells>
						<cell>
							<entries>
								<entry>
									<entrytype>3</entrytype>
									<entryhandle>L_NA_6_1</entryhandle>
								</entry>
								<entry>
									<entrytype>0</entrytype>
									<entryhandle>LPSR_BROM_BoingHi_6</entryhandle>
								</entry>
							</entries>
						</cell>
					</cells>
				</id>
				<id>
					<idname>60</idname>
					<cells>
						<cell>
							<entries>
								<entry>
									<entrytype>3</entrytype>
									<entryhandle>L_NA_7_1</entryhandle>
								</entry>
								<entry>
									<entrytype>0</entrytype>
									<entryhandle>LPSR_BROM_BoingHi_6</entryhandle>
								</entry>
							</entries>
						</cell>
					</cells>
				</id>
				<id>
					<idname>70</idname>
					<cells>
						<cell>
							<entries>
								<entry>
									<entrytype>3</entrytype>
									<entryhandle>L_NA_8_1</entryhandle>
								</entry>
								<entry>
									<entrytype>0</entrytype>
									<entryhandle>LPSR_BROM_BoingHi_6</entryhandle>
								</entry>
							</entries>
						</cell>
					</cells>
				</id>
				<id>
					<idname>80</idname>
					<cells>
						<cell>
							<entries>
								<entry>
									<entrytype>3</entrytype>
									<entryhandle>L_NA_9_1</entryhandle>
								</entry>
								<entry>
									<entrytype>0</entrytype>
									<entryhandle>LPSR_BROM_BoingHi_6</entryhandle>
								</entry>
							</entries>
						</cell>
					</cells>
				</id>
				<id>
					<idname>90</idname>
					<cells>
						<cell>
							<entries>
								<entry>
									<entrytype>3</entrytype>
									<entryhandle>L_NA_1_1</entryhandle>
								</entry>
								<entry>
									<entrytype>0</entrytype>
									<entryhandle>LPSR_BROM_BoingHi_6</entryhandle>
								</entry>
							</entries>
						</cell>
					</cells>
				</id>
				<id>
					<idname>100</idname>
					<cells>
						<cell>
							<entries>
								<entry>
									<entrytype>3</entrytype>
									<entryhandle>L_NA_2_1</entryhandle>
								</entry>
								<entry>
									<entrytype>0</entrytype>
									<entryhandle>LPSR_BROM_BoingHi_6</entryhandle>
								</entry>
							</entries>
						</cell>
					</cells>
				</id>
				<id>
					<idname>110</idname>
					<cells>
						<cell>
							<entries>
								<entry>
									<entrytype>3</entrytype>
									<entryhandle>L_NA_3_1</entryhandle>
								</entry>
							</entries>
						</cell>
					</cells>
				</id>
            </ids>
		</table>
		<table>
			<ids>
				<id>
					<idname>10</idname>
					<cells>
						<cell>
							<entries>
								<entry>
									<entrytype>3</entrytype>
									<entryhandle>L_NA_3_1</entryhandle>
								</entry>
							</entries>
						</cell>
					</cells>
				</id>
				<id>
					<idname>20</idname>
					<cells>
						<cell>
							<entries>
								<entry>
									<entrytype>3</entrytype>
									<entryhandle>L_NA_4_1</entryhandle>
								</entry>
							</entries>
						</cell>
					</cells>
				</id>
				<id>
					<idname>30</idname>
					<cells>
						<cell>
							<entries>
								<entry>
									<entrytype>3</entrytype>
									<entryhandle>L_NA_5_1</entryhandle>
								</entry>
							</entries>
						</cell>
					</cells>
				</id>
				<id>
					<idname>40</idname>
					<cells>
						<cell>
							<entries>
								<entry>
									<entrytype>3</entrytype>
									<entryhandle>L_NA_6_1</entryhandle>
								</entry>
							</entries>
						</cell>
					</cells>
				</id>
				<id>
					<idname>50</idname>
					<cells>
						<cell>
							<entries>
								<entry>
									<entrytype>3</entrytype>
									<entryhandle>L_NA_7_1</entryhandle>
								</entry>
							</entries>
						</cell>
					</cells>
				</id>
				<id>
					<idname>60</idname>
					<cells>
						<cell>
							<entries>
								<entry>
									<entrytype>3</entrytype>
									<entryhandle>L_NA_8_1</entryhandle>
								</entry>
							</entries>
						</cell>
					</cells>
				</id>
				<id>
					<idname>70</idname>
					<cells>
						<cell>
							<entries>
								<entry>
									<entrytype>3</entrytype>
									<entryhandle>L_NA_9_1</entryhandle>
								</entry>
							</entries>
						</cell>
					</cells>
				</id>
				<id>
					<idname>80</idname>
					<cells>
						<cell>
							<entries>
								<entry>
									<entrytype>3</entrytype>
									<entryhandle>L_NA_1_1</entryhandle>
								</entry>
							</entries>
						</cell>
					</cells>
				</id>
				<id>
					<idname>90</idname>
					<cells>
						<cell>
							<entries>
								<entry>
									<entrytype>3</entrytype>
									<entryhandle>L_NA_2_1</entryhandle>
								</entry>
							</entries>
						</cell>
					</cells>
				</id>
				<id>
					<idname>100</idname>
					<cells>
						<cell>
							<entries>
								<entry>
									<entrytype>3</entrytype>
									<entryhandle>L_NA_3_1</entryhandle>
								</entry>
							</entries>
						</cell>
					</cells>
				</id>
            </ids>
		</table>
	</tables>
</audio_dataset>
